2020/12;26000;Ministério da Educação;26432;Instituto Federal do Paraná;158009;INSTITUTO FEDERAL DO PARANA;26432.0;INSTITUTO FEDERAL DO PARANA;26432;INSTITUTO FEDERAL DO PARANA - IFPR;12;Educação;363;Ensino profissional;2080;EDUCACAO DE QUALIDADE PARA TODOS;20RL;FUNCIONAMENTO DAS INSTITUICOES DA REDE FEDERAL DE EDUCACAO PROFISSIONAL, CIENTIFICA E TECNOLOGICA;0000;FUNCIONAMENTO DE INSTITUICOES FEDERAIS DE EDUCACAO PROFISSIONAL E TECNOLOGICA - DESPESAS DIVERSAS;00;NAO ATRIBUIDO;3;Outras Despesas Correntes;92;Despesas de Exercícios Anteriores;90;Reserva de Contingência;0.0;0.0;0.0;0.0;254.38;0.0
2020/12;22000;Ministério da Agricultura, Pecuária e Abastec;22211;Companhia Nacional de Abastecimento;135587;CONAB SEDE SUREG RORAIMA;22211.0;COMPANHIA NACIONAL DE ABASTECIMENTO;22211;COMPANHIA NACIONAL DE ABASTECIMENTO;20;Agricultura;122;Administração geral;32;PROGRAMA DE GESTAO E MANUTENCAO DO PODER EXECUTIVO;2000;ADMINISTRACAO DA UNIDADE;0001;COORDENACAO E GESTAO DO ABASTECIMENTO AGROALIMENTAR;00;NAO ATRIBUIDO;3;Outras Despesas Correntes;37;Locação de Mão-de-Obra;90;Reserva de Contingência;0.0;0.0;11883.14;0.0;0.0;0.0
2020/12;52000;Ministério da Defesa;52904;Fundo do Exército;167159;18 GRUPO DE ARTILHARIA DE CAMPANHA;1.0;TESOURO NACIONAL;52921;FUNDO DO EXERCITO;5;Defesa nacional;301;Atenção básica;32;PROGRAMA DE GESTAO E MANUTENCAO DO PODER EXECUTIVO;2004;ASSISTENCIA MEDICA E ODONTOLOGICA AOS SERVIDORES CIVIS, EMPREGADOS, MILITARES E SEUS DEPENDENTES;0004;ATENDIMENTO MEDICO-HOSPITALAR MILITAR - EX-COMBATENTES;00;NAO ATRIBUIDO;3;Outras Despesas Correntes;39;Outros Serviços de Terceiros - Pessoa Jurídic;90;Reserva de Contingência;0.0;0.0;995.63;0.0;0.0;0.0
2020/12;26000;Ministério da Educação;26443;Empresa Brasileira de Serviços Hospitalares;155019;EBSERH HUJM-UFMT;26443.0;EMPRESA BRASILEIRA DE SERVICOS HOSPITALARES;26443;EMPRESA BRASIL.DE SERV.HOSPITALARES - EBSERH;10;Saúde;122;Administração geral;5013;EDUCACAO SUPERIOR - GRADUACAO, POS-GRADUACAO, ENSINO, PESQUI;21C0;ENFRENTAMENTO DA EMERGENCIA DE SAUDE PUBLICA DE IMPORTANCIA INTERNACIONAL DECORRENTE DO CORONAVIRUS;MP10;MEDIDA PROVISORIA N. 924, DE 13/03/2020;00;NAO ATRIBUIDO;3;Outras Despesas Correntes;30;Material de Consumo;90;Reserva de Contingência;25392.28;57235.08;29091.0;0.0;0.0;0.0
2020/12;52000;Ministério da Defesa;52121;Comando do Exército;160518;BASE DE AVIACAO DE TAUBATE;1.0;TESOURO NACIONAL;52121;COMANDO DO EXERCITO;5;Defesa nacional;153;Defesa terrestre;6012;DEFESA NACIONAL;21A0;APRESTAMENTO DAS FORCAS;0006;LOGISTICA DE MATERIAL DE AVIACAO;00;NAO ATRIBUIDO;4;Investimentos;52;Equipamentos e Material Permanente;90;Reserva de Contingência;40596.08;0.0;0.0;0.0;0.0;0.0
2020/12;26000;Ministério da Educação;26238;Universidade Federal de Minas Gerais;153278;ESCOLA EDUCACAO FISICA FISIOT.TERAP.OCUP/UFMG;15229.0;UNIVERSIDADE FEDERAL DE MINAS GERAIS;26238;UNIVERSIDADE FEDERAL DE MINAS GERAIS;12;Educação;364;Ensino superior;5013;EDUCACAO SUPERIOR - GRADUACAO, POS-GRADUACAO, ENSINO, PESQUI;20RK;FUNCIONAMENTO DE INSTITUICOES FEDERAIS DE ENSINO SUPERIOR;0000;FUNCIONAMENTO DE INSTITUICOES FEDERAIS DE ENSINO SUPERIOR - DESPESAS DIVERSAS;00;NAO ATRIBUIDO;4;Investimentos;52;Equipamentos e Material Permanente;90;Reserva de Contingência;1184.59;0.0;0.0;0.0;0.0;0.0
2020/12;26000;Ministério da Educação;26281;Fundação Universidade Federal de Sergipe;154050;FUNDACAO UNIVERSIDADE FEDERAL DE SERGIPE;15267.0;FUNDACAO UNIVERSIDADE FEDERAL DE SERGIPE;26281;FUNDACAO UNIVERSIDADE FEDERAL DE SERGIPE;28;Encargos especiais;846;Outros encargos especiais;910;OPERACOES ESPECIAIS: GESTAO DA PARTICIPACAO EM ORGANISMOS E;00PW;CONTRIBUICOES A ENTIDADES NACIONAIS SEM EXIGENCIA DE PROGRAMACAO ESPECIFICA;000A;ANUIDADE ANDIFES;00;NAO ATRIBUIDO;3;Outras Despesas Correntes;41;Contribuições;50;Transferências a Instituições Privadas sem Fins Lucrativos;9801.43;0.0;0.0;0.0;0.0;0.0
2020/12;26000;Ministério da Educação;26290;Instituto Nacional de Estudos e Pesquisas Educacionais Anísio Teixeira;153978;INST.NACIONAL DE EST.E PESQUISAS EDUCACIONAIS;26290.0;INSTITUTO NACIONAL DE EST.E PESQ.EDUCACIONAIS;26290;INEP-INST.NAC.DE ESTUDOS E PESQ.EDUCACIONAIS;12;Educação;122;Administração geral;32;PROGRAMA DE GESTAO E MANUTENCAO DO PODER EXECUTIVO;20TP;ATIVOS CIVIS DA UNIAO;0000;ATIVOS CIVIS DA UNIAO;00;NAO ATRIBUIDO;1;Pessoal e Encargos Sociais;11;Vencimentos e Vantagens Fixas - Pessoal Civil;90;Reserva de Contingência;0.0;0.0;3155587.93;0.0;0.0;0.0
2020/12;26000;Ministério da Educação;26443;Empresa Brasileira de Serviços Hospitalares;155903;EBSERH HU-UFJF;26443.0;EMPRESA BRASILEIRA DE SERVICOS HOSPITALARES;26443;EMPRESA BRASIL.DE SERV.HOSPITALARES - EBSERH;12;Educação;302;Assistência hospitalar e ambulatorial;2080;EDUCACAO DE QUALIDADE PARA TODOS;20RX;REESTRUTURACAO E MODERNIZACAO DOS HOSPITAIS UNIVERSITARIOS FEDERAIS;0000;REESTRUTURACAO E MODERNIZACAO DOS HOSPITAIS UNIVERSITARIOS FEDERAIS;00;NAO ATRIBUIDO;3;Outras Despesas Correntes;30;Material de Consumo;90;Reserva de Contingência;0.0;0.0;0.0;0.0;2752.52;46325.15
2020/12;32000;Ministério de Minas e Energia;32396;Agência Nacional de Mineração;323104;GERêNCIA REGIONAL DA ANM - MG;32396.0;AGENCIA NACIONAL DE MINERACAO;32396;AGENCIA NACIONAL DE MINERACAO;22;Indústria;122;Administração geral;32;PROGRAMA DE GESTAO E MANUTENCAO DO PODER EXECUTIVO;2000;ADMINISTRACAO DA UNIDADE;000B;ADMINISTRACAO DA GERENCIA REGIONAL DA ANM DE MINAS GERAIS;00;NAO ATRIBUIDO;3;Outras Despesas Correntes;37;Locação de Mão-de-Obra;90;Reserva de Contingência;0.0;79836.57;79836.57;0.0;0.0;0.0
2020/12;30000;Ministério da Justiça e Segurança Pública;30802;Departamento de Polícia Rodoviária Federal;200131;SUPERINTENDENCIA REG. POL. RODV. FEDERAL-RO;1.0;TESOURO NACIONAL;30107;DEPARTAMENTO DE POLICIA RODOVIARIA FEDERAL;6;Segurança pública;122;Administração geral;32;PROGRAMA DE GESTAO E MANUTENCAO DO PODER EXECUTIVO;2000;ADMINISTRACAO DA UNIDADE;0003;TECNOLOGIA DA INFORMACAO E COMUNICACAO;00;NAO ATRIBUIDO;3;Outras Despesas Correntes;40;Serviços de Tecnologia da Informação e Comuni;90;Reserva de Contingência;72108.13;11033.78;11033.78;0.0;0.0;0.0
