2020/11;26000;Ministério da Educação;26443;Empresa Brasileira de Serviços Hospitalares;155910;HU. MONSENHOR JOAO BATISTA DE CARVALHO DALTRO;26443.0;EMPRESA BRASILEIRA DE SERVICOS HOSPITALARES;36901;FUNDO NACIONAL DE SAUDE;10;Saúde;302;Assistência hospitalar e ambulatorial;2015;FORTALECIMENTO DO SISTEMA UNICO DE SAUDE (SUS);20G8;REESTRUTURACAO DOS SERVICOS AMBULATORIAIS E HOSPITALARES PRESTADOS PELOS HOSPITAIS UNIVERSITARIOS FEDERAIS (FINANCIAMENTO PARTILHADO - REHUF);0000;REESTRUTURACAO DOS SERVICOS AMBULATORIAIS E HOSPITALARES PRESTADOS PELOS HOSPITAIS UNIVERSITARIOS FEDERAIS (FINANCIAMENTO PARTILHADO - REHUF);00;NAO ATRIBUIDO;3;Outras Despesas Correntes;30;Material de Consumo;90;Reserva de Contingência;0.0;0.0;0.0;0.0;0.0;50844.0
2020/11;26000;Ministério da Educação;26352;Fundação Universidade Federal do ABC;154503;FUNDACAO UNIVERSIDADE FEDERAL DO ABC;26352.0;FUNDACAO UNIVERSIDADE FEDERAL DO ABC;26352;FUNDACAO UNIVERSIDADE FEDERAL DO ABC;28;Encargos especiais;846;Outros encargos especiais;910;OPERACOES ESPECIAIS: GESTAO DA PARTICIPACAO EM ORGANISMOS E;00PW;CONTRIBUICOES A ENTIDADES NACIONAIS SEM EXIGENCIA DE PROGRAMACAO ESPECIFICA;0003;CONTRIBUICAO A ASSOCIACAO GRUPO COIMBRA DE UNIVERSIDADES BRASILEIRAS (GCUB);00;NAO ATRIBUIDO;3;Outras Despesas Correntes;39;Outros Serviços de Terceiros - Pessoa Jurídic;50;Transferências a Instituições Privadas sem Fins Lucrativos;9801.15;0.0;0.0;0.0;0.0;0.0
2020/11;26000;Ministério da Educação;26450;Universidade Federal do Sul da Bahia;158720;UNIVERSIDADE FEDERAL DO SUL DA BAHIA;26450.0;UNIVERSIDADE FEDERAL DO SUL DA BAHIA;26450;UNIVERSIDADE FEDERAL DO SUL DA BAHIA - UFESBA;12;Educação;364;Ensino superior;32;PROGRAMA DE GESTAO E MANUTENCAO DO PODER EXECUTIVO;20TP;ATIVOS CIVIS DA UNIAO;0000;ATIVOS CIVIS DA UNIAO;00;NAO ATRIBUIDO;1;Pessoal e Encargos Sociais;4;Contratação por Tempo Determinado;90;Reserva de Contingência;0.0;0.0;73267.06;0.0;0.0;0.0
2020/11;30000;Ministério da Justiça e Segurança Pública;30000;Ministério da Justiça e Segurança Pública - Unidades com vínculo direto;200006;COORDENACAO-GERAL DE GESTÃO DE PESSOAS-CGGP;1.0;TESOURO NACIONAL;30101;MINISTERIO DA JUSTICA E SEGURANçA PUBLICA;6;Segurança pública;122;Administração geral;32;PROGRAMA DE GESTAO E MANUTENCAO DO PODER EXECUTIVO;20TP;ATIVOS CIVIS DA UNIAO;0000;ATIVOS CIVIS DA UNIAO;00;NAO ATRIBUIDO;1;Pessoal e Encargos Sociais;11;Vencimentos e Vantagens Fixas - Pessoal Civil;90;Reserva de Contingência;0.0;0.0;4604439.48;0.0;0.0;0.0
2020/11;25000;Ministério da Economia;25000;Ministério da Economia - Unidades com vínculo direto;170607;DIRETORIA DE ADMINISTRACAO E LOGISTICA;;;71104;REMUN.DE AGENTES FINANC. - REC.SOB SUPERV./MF;28;Encargos especiais;846;Outros encargos especiais;911;OPERACOES ESPECIAIS - REMUNERACAO DE AGENTES FINANCEIROS;00M4;REMUNERACAO A AGENTES FINANCEIROS;0007;REMUNERACAO DE AGENTES FINANCEIROS PAGADORES E OPERADORES DO SEGURO-DESEMPREGO E DO ABONO SALARIAL;00;NAO ATRIBUIDO;3;Outras Despesas Correntes;92;Despesas de Exercícios Anteriores;90;Reserva de Contingência;0.0;0.0;0.0;516952.36;0.0;0.0
2020/11;24000;Ministério da Ciência, Tecnologia, Inovações ;20402;Agência Espacial Brasileira;203001;AGENCIA ESPACIAL BRASILEIRA/AEB;20402.0;AGENCIA ESPACIAL BRASILEIRA - AEB;24205;AGENCIA ESPACIAL BRASILEIRA - AEB;19;Ciência e Tecnologia;572;Desenvolvimento tecnológico e engenharia;2207;PROGRAMA ESPACIAL BRASILEIRO;21AI;INFRAESTRUTURA E APLICACOES ESPACIAIS;0004;FUNCIONAMENTO E ATUALIZACAO DA INFRAESTRUTURA DE APOIO A VEICULOS ESPACIAIS;00;NAO ATRIBUIDO;3;Outras Despesas Correntes;35;Serviços de Consultoria;90;Reserva de Contingência;0.0;-160248.29;-160248.29;0.0;0.0;0.0
2020/11;35000;Ministério das Relações Exteriores;35000;Ministério das Relações Exteriores - Unidades com vínculo direto;240077;CONSULADO-GERAL DO BRASIL EM ROMA;1.0;TESOURO NACIONAL;35101;MINISTERIO DAS RELACOES EXTERIORES;7;Relações exteriores;211;Relações diplomáticas;2216;POLITICA EXTERNA;20WW;RELACOES E NEGOCIACOES BILATERAIS;000E;SERVICOS E MANUTENCAO DO POSTO (SMP);00;NAO ATRIBUIDO;3;Outras Despesas Correntes;39;Outros Serviços de Terceiros - Pessoa Jurídic;90;Reserva de Contingência;14162.07;10389.95;10389.95;0.0;0.0;0.0
2020/11;52000;Ministério da Defesa;52121;Comando do Exército;160142;9.BATALHAO DE SUPRIMENTO;1.0;TESOURO NACIONAL;52121;COMANDO DO EXERCITO;5;Defesa nacional;331;Proteção e benefícios ao trabalhador;2108;PROGRAMA DE GESTAO E MANUTENCAO DO MINISTERIO DA DEFESA;212B;BENEFICIOS OBRIGATORIOS AOS SERVIDORES CIVIS, EMPREGADOS, MILITARES E SEUS DEPENDENTES;0006;ALIMENTACAO DE MILITARES EM RANCHO;00;NAO ATRIBUIDO;3;Outras Despesas Correntes;39;Outros Serviços de Terceiros - Pessoa Jurídic;90;Reserva de Contingência;0.0;0.0;0.0;0.0;0.0;8382.8
2020/11;52000;Ministério da Defesa;52121;Comando do Exército;160244;COMANDO DE ARTILHARIA DIVISIONARIA DA 1 DE;1.0;TESOURO NACIONAL;52903;FUNDO DO SERVICO MILITAR;5;Defesa nacional;122;Administração geral;6012;DEFESA NACIONAL;2872;MOBILIZACAO PARA O SERVICO MILITAR OBRIGATORIO;0000;MOBILIZACAO PARA O SERVICO MILITAR OBRIGATORIO;00;NAO ATRIBUIDO;3;Outras Despesas Correntes;30;Material de Consumo;90;Reserva de Contingência;5688.0;0.0;0.0;0.0;0.0;0.0
